{
  "engineContract": {
    "id": "jsm-concept-matching",
    "version": 1
  },
  "migrationProvenance": {
    "archiveDatabaseSha256": "ce8469d4bd067ce3cfdb0de44e9cd9c994bd8d5da403c598890197387085ed3c",
    "phase1ExportSha256": "e6a3e05ceccec71e7e2a50e4aaea64e36e667ed9278fe4eb234da951a1acb3f0",
    "sqliteRuntimeFingerprint": "9d491a52ed1046fa319f2b6b9f4d81048b77f9d4a6774d803a14afee5ae06d2a"
  },
  "regexPolicy": {
    "localNegationTimeoutBehavior": "reject-match",
    "maximumPatternLength": 4096,
    "options": [
      "IgnoreCase",
      "CultureInvariant"
    ],
    "preferNonBacktracking": true,
    "ruleTimeoutBehavior": "record-non-match",
    "timeoutMilliseconds": 100,
    "unsupportedRegexFallback": "bounded-backtracking"
  },
  "rules": [
    {
      "conceptId": "responsibility.architecture-heavy",
      "description": "Migrated from the last production RegEx detector; historical runtime usage was unavailable.",
      "executionOrder": 0,
      "kind": "positive-evidence",
      "pattern": "\\barchitecture\\s+roadmap\\b",
      "provenance": "legacy-regex-catalog-v9",
      "ruleId": "legacy-22002883c14ca3d113f263f9",
      "scope": "both"
    },
    {
      "conceptId": "responsibility.architecture-heavy",
      "description": "Migrated from the last production RegEx detector; historical runtime usage was unavailable.",
      "executionOrder": 1,
      "kind": "positive-evidence",
      "pattern": "\\bchief\\s+architect\\b",
      "provenance": "legacy-regex-catalog-v9",
      "ruleId": "legacy-882bd58399e2586a5c670452",
      "scope": "both"
    },
    {
      "conceptId": "responsibility.architecture-heavy",
      "description": "Migrated from the last production RegEx detector; historical runtime usage was unavailable.",
      "executionOrder": 2,
      "kind": "positive-evidence",
      "pattern": "\\bdefine\\s+(?:the\\s+)?(?:technical|solution|system)\\s+architecture\\b",
      "provenance": "legacy-regex-catalog-v9",
      "ruleId": "legacy-f0ae0960ec8cc858fd7135a0",
      "scope": "both"
    },
    {
      "conceptId": "responsibility.architecture-heavy",
      "description": "Migrated from the last production RegEx detector; historical runtime usage was unavailable.",
      "executionOrder": 3,
      "kind": "title-evidence",
      "pattern": "\\barchitect(?:ure)?\\b",
      "provenance": "legacy-regex-catalog-v9",
      "ruleId": "legacy-92f6c0220172e360835793c2",
      "scope": "title"
    },
    {
      "conceptId": "responsibility.budget-ownership",
      "description": "Migrated from the last production RegEx detector; historical runtime usage was unavailable.",
      "executionOrder": 4,
      "kind": "positive-evidence",
      "pattern": "\\bown(?:ership)?\\s+of\\s+(?:the\\s+)?budget\\b",
      "provenance": "legacy-regex-catalog-v9",
      "ruleId": "legacy-072615e55456555c802a9978",
      "scope": "both"
    },
    {
      "conceptId": "responsibility.budget-ownership",
      "description": "Migrated from the last production RegEx detector; historical runtime usage was unavailable.",
      "executionOrder": 5,
      "kind": "positive-evidence",
      "pattern": "\\bmanage\\s+(?:the\\s+)?(?:program|project|department)\\s+budget\\b",
      "provenance": "legacy-regex-catalog-v9",
      "ruleId": "legacy-587cb11b384a27c3b365132a",
      "scope": "both"
    },
    {
      "conceptId": "responsibility.budget-ownership",
      "description": "Migrated from the last production RegEx detector; historical runtime usage was unavailable.",
      "executionOrder": 6,
      "kind": "positive-evidence",
      "pattern": "\\bP&L\\s+responsibility\\b",
      "provenance": "legacy-regex-catalog-v9",
      "ruleId": "legacy-92142c0234b8ce22522d9e2c",
      "scope": "both"
    },
    {
      "conceptId": "responsibility.customer-facing",
      "description": "Migrated from the last production RegEx detector; historical runtime usage was unavailable.",
      "executionOrder": 7,
      "kind": "positive-evidence",
      "pattern": "\\bcustomer[- ]facing\\b",
      "provenance": "legacy-regex-catalog-v9",
      "ruleId": "legacy-7c24bc91cee2f3c8f81872ed",
      "scope": "both"
    },
    {
      "conceptId": "responsibility.customer-facing",
      "description": "Migrated from the last production RegEx detector; historical runtime usage was unavailable.",
      "executionOrder": 8,
      "kind": "positive-evidence",
      "pattern": "\\binterface\\s+(?:directly\\s+)?with\\s+(?:customers|clients)\\b",
      "provenance": "legacy-regex-catalog-v9",
      "ruleId": "legacy-bf1e2a9a3cebfc1c01381c35",
      "scope": "both"
    },
    {
      "conceptId": "responsibility.documentation-heavy",
      "description": "Migrated from the last production RegEx detector; historical runtime usage was unavailable.",
      "executionOrder": 9,
      "kind": "positive-evidence",
      "pattern": "\\bextensive\\s+(?:technical\\s+)?documentation\\b",
      "provenance": "legacy-regex-catalog-v9",
      "ruleId": "legacy-778085f3dad50e623d43726c",
      "scope": "both"
    },
    {
      "conceptId": "responsibility.documentation-heavy",
      "description": "Migrated from the last production RegEx detector; historical runtime usage was unavailable.",
      "executionOrder": 10,
      "kind": "positive-evidence",
      "pattern": "\\bdevelop\\s+and\\s+maintain\\s+(?:technical\\s+)?documentation\\b",
      "provenance": "legacy-regex-catalog-v9",
      "ruleId": "legacy-a24a958fb804f167a7179dc1",
      "scope": "both"
    },
    {
      "conceptId": "responsibility.documentation-heavy",
      "description": "Migrated from the last production RegEx detector; historical runtime usage was unavailable.",
      "executionOrder": 11,
      "kind": "title-evidence",
      "pattern": "\\bdocumentation\\s+specialist\\b",
      "provenance": "legacy-regex-catalog-v9",
      "ruleId": "legacy-81be14ec65e20caad98f615c",
      "scope": "title"
    },
    {
      "conceptId": "responsibility.documentation-heavy",
      "description": "Migrated from the last production RegEx detector; historical runtime usage was unavailable.",
      "executionOrder": 12,
      "kind": "title-evidence",
      "pattern": "\\btechnical\\s+writer\\b",
      "provenance": "legacy-regex-catalog-v9",
      "ruleId": "legacy-84374bf917d3208a8cc6c7f0",
      "scope": "title"
    },
    {
      "conceptId": "responsibility.hands-on-implementation",
      "description": "Migrated from the last production RegEx detector; historical runtime usage was unavailable.",
      "executionOrder": 13,
      "kind": "positive-evidence",
      "pattern": "\\bimplement\\s+and\\s+deploy\\b",
      "provenance": "legacy-regex-catalog-v9",
      "ruleId": "legacy-7e27dc6ca5f0f00bc3a9955c",
      "scope": "both"
    },
    {
      "conceptId": "responsibility.hands-on-implementation",
      "description": "Migrated from the last production RegEx detector; historical runtime usage was unavailable.",
      "executionOrder": 14,
      "kind": "positive-evidence",
      "pattern": "\\bhands[- ]on\\s+(?:work|implementation|development|engineering|coding|configuration)\\b",
      "provenance": "legacy-regex-catalog-v9",
      "ruleId": "legacy-b4495b4c63d8991aa2ee0e2e",
      "scope": "both"
    },
    {
      "conceptId": "responsibility.operations-sustainment",
      "description": "Migrated from the last production RegEx detector; historical runtime usage was unavailable.",
      "executionOrder": 15,
      "kind": "positive-evidence",
      "pattern": "\\bon[- ]call\\s+rotation\\b",
      "provenance": "legacy-regex-catalog-v9",
      "ruleId": "legacy-6ceec2a006415a32e5d43144",
      "scope": "both"
    },
    {
      "conceptId": "responsibility.operations-sustainment",
      "description": "Migrated from the last production RegEx detector; historical runtime usage was unavailable.",
      "executionOrder": 16,
      "kind": "positive-evidence",
      "pattern": "\\boperations?\\s+and\\s+sustainment\\b",
      "provenance": "legacy-regex-catalog-v9",
      "ruleId": "legacy-6e54ae5f77581693d9c7c3c3",
      "scope": "both"
    },
    {
      "conceptId": "responsibility.operations-sustainment",
      "description": "Migrated from the last production RegEx detector; historical runtime usage was unavailable.",
      "executionOrder": 17,
      "kind": "positive-evidence",
      "pattern": "\\bproduction\\s+operations\\s+support\\b",
      "provenance": "legacy-regex-catalog-v9",
      "ruleId": "legacy-a639265499a0c4e3a23328cf",
      "scope": "both"
    },
    {
      "conceptId": "responsibility.personnel-management",
      "description": "Migrated from the last production RegEx detector; historical runtime usage was unavailable.",
      "executionOrder": 18,
      "kind": "positive-evidence",
      "pattern": "\\bdirect\\s+reports?\\b",
      "provenance": "legacy-regex-catalog-v9",
      "ruleId": "legacy-46af028e37910f246e620888",
      "scope": "both"
    },
    {
      "conceptId": "responsibility.personnel-management",
      "description": "Migrated from the last production RegEx detector; historical runtime usage was unavailable.",
      "executionOrder": 19,
      "kind": "positive-evidence",
      "pattern": "\\bhire,?\\s+(?:coach,?\\s+)?and\\s+develop\\b",
      "provenance": "legacy-regex-catalog-v9",
      "ruleId": "legacy-79bba4fe3d52d96bdf5908d4",
      "scope": "both"
    },
    {
      "conceptId": "responsibility.personnel-management",
      "description": "Migrated from the last production RegEx detector; historical runtime usage was unavailable.",
      "executionOrder": 20,
      "kind": "positive-evidence",
      "pattern": "\\bperformance\\s+(?:reviews?|management)\\b",
      "provenance": "legacy-regex-catalog-v9",
      "ruleId": "legacy-cae9f13c3b321c8fe320c906",
      "scope": "both"
    },
    {
      "conceptId": "responsibility.proposal-capture",